{
  "document_id": "quote_006",
  "sha256": "c9345be15170e0371dd6e89d63e361463a455ea89f4866b333d5a8e41507bed1",
  "doc_type": "quote",
  "fields": [
    {
      "name": "quote_reference",
      "value": "QT-2026-0006",
      "page": 1,
      "bbox": [
        86.03,
        110.37,
        144.55,
        122.76
      ],
      "verbatim_span": "QT-2026-0006",
      "labeller": "Srini",
      "labelled_at": "2026-10-15T11:00:53+00:00"
    },
    {
      "name": "quote_date",
      "value": "2026-10-19",
      "page": 1,
      "bbox": [
        361.03,
        110.37,
        407.06,
        122.76
      ],
      "verbatim_span": "2026-10-19",
      "labeller": "Srini",
      "labelled_at": "2026-10-15T11:00:53+00:00"
    },
    {
      "name": "valid_until",
      "value": "2026-11-18",
      "page": 1,
      "bbox": [
        85.51,
        132.37,
        131.54,
        144.76
      ],
      "verbatim_span": "2026-11-18",
      "labeller": "Srini",
      "labelled_at": "2026-10-15T11:00:53+00:00"
    },
    {
      "name": "currency",
      "value": "EUR",
      "page": 1,
      "bbox": [
        351.51,
        132.37,
        370.51,
        144.76
      ],
      "verbatim_span": "EUR",
      "labeller": "Srini",
      "labelled_at": "2026-10-15T11:00:53+00:00"
    },
    {
      "name": "incoterms",
      "value": "EXW",
      "page": 1,
      "bbox": [
        84.51,
        154.37,
        105.02,
        166.76
      ],
      "verbatim_span": "EXW",
      "labeller": "Srini",
      "labelled_at": "2026-10-15T11:00:53+00:00"
    },
    {
      "name": "payment_terms",
      "value": "Net 30",
      "page": 1,
      "bbox": [
        378.52,
        154.37,
        405.53,
        166.76
      ],
      "verbatim_span": "Net 30",
      "labeller": "Srini",
      "labelled_at": "2026-10-15T11:00:53+00:00"
    },
    {
      "name": "line_items[0].part_number_quoted",
      "value": "PMP-140",
      "page": 1,
      "bbox": [
        40.0,
        231.32,
        77.51,
        243.69
      ],
      "verbatim_span": "PMP-140",
      "labeller": "Srini",
      "labelled_at": "2026-10-15T11:00:53+00:00"
    },
    {
      "name": "line_items[0].quantity",
      "value": 52,
      "page": 1,
      "bbox": [
        166.0,
        231.32,
        176.01,
        243.69
      ],
      "verbatim_span": "52",
      "labeller": "Srini",
      "labelled_at": "2026-10-15T11:00:53+00:00"
    },
    {
      "name": "line_items[0].unit_price",
      "value": 35.95,
      "page": 1,
      "bbox": [
        223.0,
        231.32,
        245.52,
        243.69
      ],
      "verbatim_span": "35.95",
      "labeller": "Srini",
      "labelled_at": "2026-10-15T11:00:53+00:00"
    },
    {
      "name": "line_items[0].extended_price",
      "value": 1869.4,
      "page": 1,
      "bbox": [
        310.0,
        231.32,
        342.53,
        243.69
      ],
      "verbatim_span": "1869.40",
      "labeller": "Srini",
      "labelled_at": "2026-10-15T11:00:53+00:00"
    },
    {
      "name": "line_items[0].lead_time_days",
      "value": 13,
      "page": 1,
      "bbox": [
        409.0,
        231.32,
        419.01,
        243.69
      ],
      "verbatim_span": "13",
      "labeller": "Srini",
      "labelled_at": "2026-10-15T11:00:53+00:00"
    },
    {
      "name": "line_items[0].moq",
      "value": 11,
      "page": 1,
      "bbox": [
        497.0,
        234.54,
        507.01,
        242.86
      ],
      "verbatim_span": "11",
      "labeller": "Srini",
      "labelled_at": "2026-10-15T11:00:53+00:00",
      "bbox_corrected": "2026-10-13 tools.validate_golden --fix-bboxes"
    },
    {
      "name": "line_items[1].part_number_quoted",
      "value": "CPL-778",
      "page": 1,
      "bbox": [
        40.0,
        256.33,
        75.51,
        268.69
      ],
      "verbatim_span": "CPL-778",
      "labeller": "Srini",
      "labelled_at": "2026-10-15T11:00:53+00:00"
    },
    {
      "name": "line_items[1].quantity",
      "value": 65,
      "page": 1,
      "bbox": [
        166.0,
        256.33,
        176.01,
        268.69
      ],
      "verbatim_span": "65",
      "labeller": "Srini",
      "labelled_at": "2026-10-15T11:00:53+00:00"
    },
    {
      "name": "line_items[1].unit_price",
      "value": 48.7,
      "page": 1,
      "bbox": [
        223.0,
        256.33,
        245.52,
        268.69
      ],
      "verbatim_span": "48.70",
      "labeller": "Srini",
      "labelled_at": "2026-10-15T11:00:53+00:00"
    },
    {
      "name": "line_items[1].extended_price",
      "value": 3165.5,
      "page": 1,
      "bbox": [
        310.0,
        256.33,
        342.53,
        268.69
      ],
      "verbatim_span": "3165.50",
      "labeller": "Srini",
      "labelled_at": "2026-10-15T11:00:53+00:00"
    },
    {
      "name": "line_items[1].lead_time_days",
      "value": 14,
      "page": 1,
      "bbox": [
        409.0,
        259.54,
        419.01,
        267.86
      ],
      "verbatim_span": "14",
      "labeller": "Srini",
      "labelled_at": "2026-10-15T11:00:53+00:00",
      "bbox_corrected": "2026-10-13 tools.validate_golden --fix-bboxes"
    },
    {
      "name": "line_items[1].moq",
      "value": 12,
      "page": 1,
      "bbox": [
        497.0,
        256.33,
        507.01,
        268.69
      ],
      "verbatim_span": "12",
      "labeller": "Srini",
      "labelled_at": "2026-10-15T11:00:53+00:00"
    },
    {
      "name": "line_items[2].part_number_quoted",
      "value": "MTR-420",
      "page": 1,
      "bbox": [
        40.0,
        281.33,
        77.5,
        293.69
      ],
      "verbatim_span": "MTR-420",
      "labeller": "Srini",
      "labelled_at": "2026-10-15T11:00:53+00:00"
    },
    {
      "name": "line_items[2].quantity",
      "value": 78,
      "page": 1,
      "bbox": [
        166.0,
        284.54,
        176.01,
        292.86
      ],
      "verbatim_span": "78",
      "labeller": "Srini",
      "labelled_at": "2026-10-15T11:00:53+00:00",
      "bbox_corrected": "2026-10-13 tools.validate_golden --fix-bboxes"
    },
    {
      "name": "line_items[2].unit_price",
      "value": 61.45,
      "page": 1,
      "bbox": [
        223.0,
        281.33,
        245.52,
        293.69
      ],
      "verbatim_span": "61.45",
      "labeller": "Srini",
      "labelled_at": "2026-10-15T11:00:53+00:00"
    },
    {
      "name": "line_items[2].extended_price",
      "value": 4793.1,
      "page": 1,
      "bbox": [
        310.0,
        281.33,
        342.53,
        293.69
      ],
      "verbatim_span": "4793.10",
      "labeller": "Srini",
      "labelled_at": "2026-10-15T11:00:53+00:00"
    },
    {
      "name": "line_items[2].lead_time_days",
      "value": 15,
      "page": 1,
      "bbox": [
        409.0,
        281.33,
        419.01,
        293.69
      ],
      "verbatim_span": "15",
      "labeller": "Srini",
      "labelled_at": "2026-10-15T11:00:53+00:00"
    },
    {
      "name": "line_items[2].moq",
      "value": 13,
      "page": 1,
      "bbox": [
        497.0,
        284.54,
        507.01,
        292.86
      ],
      "verbatim_span": "13",
      "labeller": "Srini",
      "labelled_at": "2026-10-15T11:00:53+00:00",
      "bbox_corrected": "2026-10-13 tools.validate_golden --fix-bboxes"
    },
    {
      "name": "supplier_name",
      "value": "Harborline Metals",
      "page": 1,
      "bbox": [
        38.0,
        28.95,
        163.86,
        49.6
      ],
      "verbatim_span": "Harborline Metals",
      "labeller": "Srini",
      "labelled_at": "2026-10-15T11:00:53+00:00"
    }
  ],
  "metadata": {
    "label_source": "programmatically generated and text-position checked with PyMuPDF",
    "human_reviewed": true,
    "original_labeller": "synthetic-generator-v1 (not human-reviewed)",
    "reviewed_by": "Srini",
    "reviewed_at": "2026-10-15T11:00:53+00:00",
    "review_changes": []
  }
}
