{
  "document_id": "quote_019",
  "sha256": "065c75cefd9799011f2a7926baeaee3c0be78f841c973c25e35247cf1d28dd8d",
  "doc_type": "quote",
  "fields": [
    {
      "name": "quote_reference",
      "value": "QT-2026-0019",
      "page": 1,
      "bbox": [
        86.03,
        110.37,
        144.55,
        122.76
      ],
      "verbatim_span": "QT-2026-0019",
      "labeller": "Srini",
      "labelled_at": "2026-10-15T11:06:57+00:00"
    },
    {
      "name": "quote_date",
      "value": "2026-10-08",
      "page": 1,
      "bbox": [
        361.03,
        110.37,
        407.06,
        122.76
      ],
      "verbatim_span": "2026-10-08",
      "labeller": "Srini",
      "labelled_at": "2026-10-15T11:06:57+00:00"
    },
    {
      "name": "valid_until",
      "value": "2026-11-07",
      "page": 1,
      "bbox": [
        85.51,
        132.37,
        131.54,
        144.76
      ],
      "verbatim_span": "2026-11-07",
      "labeller": "Srini",
      "labelled_at": "2026-10-15T11:06:57+00:00"
    },
    {
      "name": "currency",
      "value": "GBP",
      "page": 1,
      "bbox": [
        351.51,
        132.37,
        371.01,
        144.76
      ],
      "verbatim_span": "GBP",
      "labeller": "Srini",
      "labelled_at": "2026-10-15T11:06:57+00:00"
    },
    {
      "name": "incoterms",
      "value": "FOB",
      "page": 1,
      "bbox": [
        84.51,
        154.37,
        103.51,
        166.76
      ],
      "verbatim_span": "FOB",
      "labeller": "Srini",
      "labelled_at": "2026-10-15T11:06:57+00:00"
    },
    {
      "name": "payment_terms",
      "value": "Net 45",
      "page": 1,
      "bbox": [
        378.52,
        154.37,
        405.53,
        166.76
      ],
      "verbatim_span": "Net 45",
      "labeller": "Srini",
      "labelled_at": "2026-10-15T11:06:57+00:00"
    },
    {
      "name": "line_items[0].part_number_quoted",
      "value": "PCB-101",
      "page": 1,
      "bbox": [
        40.0,
        231.32,
        76.51,
        243.69
      ],
      "verbatim_span": "PCB-101",
      "labeller": "Srini",
      "labelled_at": "2026-10-15T11:06:57+00:00"
    },
    {
      "name": "line_items[0].quantity",
      "value": 143,
      "page": 1,
      "bbox": [
        166.0,
        231.32,
        181.01,
        243.69
      ],
      "verbatim_span": "143",
      "labeller": "Srini",
      "labelled_at": "2026-10-15T11:06:57+00:00"
    },
    {
      "name": "line_items[0].unit_price",
      "value": 80.8,
      "page": 1,
      "bbox": [
        223.0,
        231.32,
        245.52,
        243.69
      ],
      "verbatim_span": "80.80",
      "labeller": "Srini",
      "labelled_at": "2026-10-15T11:06:57+00:00"
    },
    {
      "name": "line_items[0].extended_price",
      "value": 11554.4,
      "page": 1,
      "bbox": [
        310.0,
        231.32,
        347.53,
        243.69
      ],
      "verbatim_span": "11554.40",
      "labeller": "Srini",
      "labelled_at": "2026-10-15T11:06:57+00:00"
    },
    {
      "name": "line_items[0].lead_time_days",
      "value": 26,
      "page": 1,
      "bbox": [
        409.0,
        234.54,
        419.01,
        242.86
      ],
      "verbatim_span": "26",
      "labeller": "Srini",
      "labelled_at": "2026-10-15T11:06:57+00:00",
      "bbox_corrected": "2026-10-13 tools.validate_golden --fix-bboxes"
    },
    {
      "name": "line_items[0].moq",
      "value": 14,
      "page": 1,
      "bbox": [
        497.0,
        234.54,
        507.01,
        242.86
      ],
      "verbatim_span": "14",
      "labeller": "Srini",
      "labelled_at": "2026-10-15T11:06:57+00:00",
      "bbox_corrected": "2026-10-13 tools.validate_golden --fix-bboxes"
    },
    {
      "name": "line_items[1].part_number_quoted",
      "value": "BRG-6205",
      "page": 1,
      "bbox": [
        40.0,
        256.33,
        82.52,
        268.69
      ],
      "verbatim_span": "BRG-6205",
      "labeller": "Srini",
      "labelled_at": "2026-10-15T11:06:57+00:00"
    },
    {
      "name": "line_items[1].quantity",
      "value": 156,
      "page": 1,
      "bbox": [
        166.0,
        256.33,
        181.01,
        268.69
      ],
      "verbatim_span": "156",
      "labeller": "Srini",
      "labelled_at": "2026-10-15T11:06:57+00:00"
    },
    {
      "name": "line_items[1].unit_price",
      "value": 93.55,
      "page": 1,
      "bbox": [
        223.0,
        256.33,
        245.52,
        268.69
      ],
      "verbatim_span": "93.55",
      "labeller": "Srini",
      "labelled_at": "2026-10-15T11:06:57+00:00"
    },
    {
      "name": "line_items[1].extended_price",
      "value": 14593.8,
      "page": 1,
      "bbox": [
        310.0,
        256.33,
        347.53,
        268.69
      ],
      "verbatim_span": "14593.80",
      "labeller": "Srini",
      "labelled_at": "2026-10-15T11:06:57+00:00"
    },
    {
      "name": "line_items[1].lead_time_days",
      "value": 27,
      "page": 1,
      "bbox": [
        409.0,
        256.33,
        419.01,
        268.69
      ],
      "verbatim_span": "27",
      "labeller": "Srini",
      "labelled_at": "2026-10-15T11:06:57+00:00"
    },
    {
      "name": "line_items[1].moq",
      "value": 5,
      "page": 1,
      "bbox": [
        497.0,
        259.54,
        502.0,
        267.86
      ],
      "verbatim_span": "5",
      "labeller": "Srini",
      "labelled_at": "2026-10-15T11:06:57+00:00",
      "bbox_corrected": "2026-10-13 tools.validate_golden --fix-bboxes"
    },
    {
      "name": "line_items[2].part_number_quoted",
      "value": "VAL-1048",
      "page": 1,
      "bbox": [
        40.0,
        281.33,
        80.02,
        293.69
      ],
      "verbatim_span": "VAL-1048",
      "labeller": "Srini",
      "labelled_at": "2026-10-15T11:06:57+00:00"
    },
    {
      "name": "line_items[2].quantity",
      "value": 169,
      "page": 1,
      "bbox": [
        166.0,
        281.33,
        181.01,
        293.69
      ],
      "verbatim_span": "169",
      "labeller": "Srini",
      "labelled_at": "2026-10-15T11:06:57+00:00"
    },
    {
      "name": "line_items[2].unit_price",
      "value": 106.3,
      "page": 1,
      "bbox": [
        223.0,
        281.33,
        250.52,
        293.69
      ],
      "verbatim_span": "106.30",
      "labeller": "Srini",
      "labelled_at": "2026-10-15T11:06:57+00:00"
    },
    {
      "name": "line_items[2].extended_price",
      "value": 17964.7,
      "page": 1,
      "bbox": [
        310.0,
        281.33,
        347.53,
        293.69
      ],
      "verbatim_span": "17964.70",
      "labeller": "Srini",
      "labelled_at": "2026-10-15T11:06:57+00:00"
    },
    {
      "name": "line_items[2].lead_time_days",
      "value": 28,
      "page": 1,
      "bbox": [
        409.0,
        281.33,
        419.01,
        293.69
      ],
      "verbatim_span": "28",
      "labeller": "Srini",
      "labelled_at": "2026-10-15T11:06:57+00:00"
    },
    {
      "name": "line_items[2].moq",
      "value": 6,
      "page": 1,
      "bbox": [
        497.0,
        284.54,
        502.0,
        292.86
      ],
      "verbatim_span": "6",
      "labeller": "Srini",
      "labelled_at": "2026-10-15T11:06:57+00:00",
      "bbox_corrected": "2026-10-13 tools.validate_golden --fix-bboxes"
    },
    {
      "name": "line_items[3].part_number_quoted",
      "value": "BOLT-M12",
      "page": 1,
      "bbox": [
        40.0,
        306.33,
        84.01,
        318.69
      ],
      "verbatim_span": "BOLT-M12",
      "labeller": "Srini",
      "labelled_at": "2026-10-15T11:06:57+00:00"
    },
    {
      "name": "line_items[3].quantity",
      "value": 22,
      "page": 1,
      "bbox": [
        166.0,
        306.33,
        176.01,
        318.69
      ],
      "verbatim_span": "22",
      "labeller": "Srini",
      "labelled_at": "2026-10-15T11:06:57+00:00"
    },
    {
      "name": "line_items[3].unit_price",
      "value": 119.05,
      "page": 1,
      "bbox": [
        223.0,
        306.33,
        250.52,
        318.69
      ],
      "verbatim_span": "119.05",
      "labeller": "Srini",
      "labelled_at": "2026-10-15T11:06:57+00:00"
    },
    {
      "name": "line_items[3].extended_price",
      "value": 2619.1,
      "page": 1,
      "bbox": [
        310.0,
        306.33,
        342.53,
        318.69
      ],
      "verbatim_span": "2619.10",
      "labeller": "Srini",
      "labelled_at": "2026-10-15T11:06:57+00:00"
    },
    {
      "name": "line_items[3].lead_time_days",
      "value": 29,
      "page": 1,
      "bbox": [
        409.0,
        306.33,
        419.01,
        318.69
      ],
      "verbatim_span": "29",
      "labeller": "Srini",
      "labelled_at": "2026-10-15T11:06:57+00:00"
    },
    {
      "name": "line_items[3].moq",
      "value": 7,
      "page": 1,
      "bbox": [
        497.0,
        309.54,
        502.0,
        317.86
      ],
      "verbatim_span": "7",
      "labeller": "Srini",
      "labelled_at": "2026-10-15T11:06:57+00:00",
      "bbox_corrected": "2026-10-13 tools.validate_golden --fix-bboxes"
    },
    {
      "name": "supplier_name",
      "value": "Granite Equipment Supply",
      "page": 1,
      "bbox": [
        38.0,
        28.95,
        226.37,
        49.6
      ],
      "verbatim_span": "Granite Equipment Supply",
      "labeller": "Srini",
      "labelled_at": "2026-10-15T11:06:57+00:00"
    }
  ],
  "metadata": {
    "label_source": "programmatically generated and text-position checked with PyMuPDF",
    "human_reviewed": true,
    "original_labeller": "synthetic-generator-v1 (not human-reviewed)",
    "reviewed_by": "Srini",
    "reviewed_at": "2026-10-15T11:06:57+00:00",
    "review_changes": []
  }
}
