{
  "document_id": "quote_008",
  "sha256": "b3531e67728b834a7cad14de959b45b08e72010f974613dc5fb075746d8b8681",
  "doc_type": "quote",
  "fields": [
    {
      "name": "quote_reference",
      "value": "QT-2026-0008",
      "page": 1,
      "bbox": [
        86.03,
        110.37,
        144.55,
        122.76
      ],
      "verbatim_span": "QT-2026-0008",
      "labeller": "Srini",
      "labelled_at": "2026-10-15T11:01:52+00:00"
    },
    {
      "name": "quote_date",
      "value": "2026-10-25",
      "page": 1,
      "bbox": [
        361.03,
        110.37,
        407.06,
        122.76
      ],
      "verbatim_span": "2026-10-25",
      "labeller": "Srini",
      "labelled_at": "2026-10-15T11:01:52+00:00"
    },
    {
      "name": "valid_until",
      "value": "2026-11-24",
      "page": 1,
      "bbox": [
        85.51,
        132.37,
        131.54,
        144.76
      ],
      "verbatim_span": "2026-11-24",
      "labeller": "Srini",
      "labelled_at": "2026-10-15T11:01:52+00:00"
    },
    {
      "name": "currency",
      "value": "CAD",
      "page": 1,
      "bbox": [
        351.51,
        132.37,
        371.0,
        144.76
      ],
      "verbatim_span": "CAD",
      "labeller": "Srini",
      "labelled_at": "2026-10-15T11:01:52+00:00"
    },
    {
      "name": "incoterms",
      "value": "FCA",
      "page": 1,
      "bbox": [
        84.51,
        154.37,
        103.01,
        166.76
      ],
      "verbatim_span": "FCA",
      "labeller": "Srini",
      "labelled_at": "2026-10-15T11:01:52+00:00"
    },
    {
      "name": "payment_terms",
      "value": "Net 60",
      "page": 1,
      "bbox": [
        378.52,
        154.37,
        405.53,
        166.76
      ],
      "verbatim_span": "Net 60",
      "labeller": "Srini",
      "labelled_at": "2026-10-15T11:01:52+00:00"
    },
    {
      "name": "line_items[0].part_number_quoted",
      "value": "MTR-420",
      "page": 1,
      "bbox": [
        40.0,
        231.32,
        77.5,
        243.69
      ],
      "verbatim_span": "MTR-420",
      "labeller": "Srini",
      "labelled_at": "2026-10-15T11:01:52+00:00"
    },
    {
      "name": "line_items[0].quantity",
      "value": 66,
      "page": 1,
      "bbox": [
        166.0,
        231.32,
        176.01,
        243.69
      ],
      "verbatim_span": "66",
      "labeller": "Srini",
      "labelled_at": "2026-10-15T11:01:52+00:00"
    },
    {
      "name": "line_items[0].unit_price",
      "value": 42.85,
      "page": 1,
      "bbox": [
        223.0,
        231.32,
        245.52,
        243.69
      ],
      "verbatim_span": "42.85",
      "labeller": "Srini",
      "labelled_at": "2026-10-15T11:01:52+00:00"
    },
    {
      "name": "line_items[0].extended_price",
      "value": 2828.1,
      "page": 1,
      "bbox": [
        310.0,
        231.32,
        342.53,
        243.69
      ],
      "verbatim_span": "2828.10",
      "labeller": "Srini",
      "labelled_at": "2026-10-15T11:01:52+00:00"
    },
    {
      "name": "line_items[0].lead_time_days",
      "value": 15,
      "page": 1,
      "bbox": [
        409.0,
        231.32,
        419.01,
        243.69
      ],
      "verbatim_span": "15",
      "labeller": "Srini",
      "labelled_at": "2026-10-15T11:01:52+00:00"
    },
    {
      "name": "line_items[0].moq",
      "value": 13,
      "page": 1,
      "bbox": [
        497.0,
        231.32,
        507.01,
        243.69
      ],
      "verbatim_span": "13",
      "labeller": "Srini",
      "labelled_at": "2026-10-15T11:01:52+00:00"
    },
    {
      "name": "supplier_name",
      "value": "Orion Motion Systems",
      "page": 1,
      "bbox": [
        38.0,
        28.95,
        197.19,
        49.6
      ],
      "verbatim_span": "Orion Motion Systems",
      "labeller": "Srini",
      "labelled_at": "2026-10-15T11:01:52+00:00"
    }
  ],
  "metadata": {
    "label_source": "programmatically generated and text-position checked with PyMuPDF",
    "human_reviewed": true,
    "original_labeller": "synthetic-generator-v1 (not human-reviewed)",
    "reviewed_by": "Srini",
    "reviewed_at": "2026-10-15T11:01:52+00:00",
    "review_changes": []
  }
}
